{
  "schema_version": "0.1.0",
  "package_id": "cross-domain-procedure-calibration",
  "version": "0.1.0",
  "provenance": [
    {
      "source_id": "sop-bench-review",
      "locator": "Transfer to skill-bench, Repair 1-10",
      "local_path": "papers/agent-benchmarks/2026-07-14-sop-bench-procedure-task-validity.md",
      "claim": "Full paper and pinned-release audit motivates field roles, independent oracles, typed comparators, deterministic replay, procedure relations, and endpoint/trace separation."
    },
    {
      "source_id": "sop-bench-release-provenance",
      "locator": "official_release and hugging_face_dataset",
      "local_path": "data/sources/releases/2506.08119v2-sop-bench/provenance.json",
      "claim": "Pins the audited release identities and paper/release timing boundary; this fixture imports no SOP-Bench task data."
    }
  ],
  "claim_limits": {
    "internal_calibration_only": true,
    "supported": ["validator rejects planted internal package inconsistencies"],
    "unsupported": ["expert approval", "professional correctness", "agent capability", "safety", "production fitness", "deployment readiness", "procedure validity", "oracle accuracy"]
  },
  "frozen_execution": {
    "generator": {"component_id": "fixture-generator", "version": "1", "sha256": "1111111111111111111111111111111111111111111111111111111111111111"},
    "loader": {"component_id": "fixture-loader", "version": "1", "sha256": "2222222222222222222222222222222222222222222222222222222222222222"},
    "tool_runtime": {"component_id": "fixture-runtime", "version": "1", "sha256": "3333333333333333333333333333333333333333333333333333333333333333"},
    "oracle_implementation": {"component_id": "fixture-oracle", "version": "1", "sha256": "4444444444444444444444444444444444444444444444444444444444444444"},
    "seed": 17,
    "frozen_time": "2026-07-14T00:00:00Z"
  },
  "fields": [
    {"field_id": "case-id", "role": "public_input", "type": "string", "surface": "public_task"},
    {"field_id": "risk-level", "role": "hidden_evidence", "type": "enum", "surface": "hidden_table"},
    {"field_id": "blocked", "role": "hidden_evidence", "type": "boolean", "surface": "hidden_table"},
    {"field_id": "evidence-score", "role": "tool_result", "type": "number", "surface": "tool_only"},
    {"field_id": "decision", "role": "scored_endpoint", "type": "enum", "surface": "final_artifact"},
    {"field_id": "review-note", "role": "audit_metadata", "type": "string", "surface": "audit_only"},
    {"field_id": "answer-key", "role": "prohibited_oracle", "type": "enum", "surface": "private_oracle"}
  ],
  "table_contract": {
    "metadata_columns": ["case-id", "risk-level", "blocked", "evidence-score", "decision", "review-note", "answer-key"],
    "observed_columns": ["case-id", "risk-level", "blocked", "evidence-score", "decision", "review-note", "answer-key"],
    "manifest_row_count": 5,
    "loaded_row_count": 5
  },
  "integrity_texts": [
    {"path": "public-procedure.md", "content": "Collect evidence, assess it, obtain approval when high risk, and use the hold fallback only when blocked."},
    {"path": "table.csv", "content": "case-id,risk-level,blocked,evidence-score,decision,review-note,answer-key"}
  ],
  "tools": [
    {
      "tool_id": "lookup-evidence",
      "component": {"component_id": "lookup-evidence-implementation", "version": "1", "sha256": "5555555555555555555555555555555555555555555555555555555555555555"},
      "arguments": [{"name": "case-id", "type": "string", "required": true, "used_by_implementation": true}],
      "return_field_ids": ["evidence-score"],
      "answer_bearing": false,
      "deterministic": true,
      "replay_digests": ["6666666666666666666666666666666666666666666666666666666666666666", "6666666666666666666666666666666666666666666666666666666666666666"]
    }
  ],
  "oracle": {
    "endpoint_field_ids": ["decision"],
    "input_field_ids": ["risk-level", "blocked", "evidence-score"],
    "independent_derivation": true,
    "derivation_component": {"component_id": "fixture-oracle", "version": "1", "sha256": "4444444444444444444444444444444444444444444444444444444444444444"},
    "reference_case_ids": ["canonical-pass", "alternative-pass", "skipped-gate", "wrong-order", "untriggered-fallback"]
  },
  "comparators": [{"field_id": "decision", "kind": "exact_enum", "null_policy": "distinct"}],
  "procedure": {
    "clauses": [
      {"clause_id": "collect", "kind": "step", "public_basis": true, "evidence_source_ids": ["sop-bench-review"]},
      {"clause_id": "assess", "kind": "step", "public_basis": true, "evidence_source_ids": ["sop-bench-review"]},
      {"clause_id": "approve", "kind": "gate", "public_basis": true, "evidence_source_ids": ["sop-bench-review"]},
      {"clause_id": "hold", "kind": "fallback", "public_basis": true, "evidence_source_ids": ["sop-bench-review"]},
      {"clause_id": "publish", "kind": "artifact", "public_basis": true, "evidence_source_ids": ["sop-bench-review"]}
    ],
    "relations": [
      {"relation_id": "collect-before-assess", "kind": "ordering", "from_clause_id": "collect", "to_clause_id": "assess"},
      {"relation_id": "high-risk-approval", "kind": "gate", "from_clause_id": "approve", "to_clause_id": "publish", "trigger_field_id": "risk-level", "trigger_value": "high"},
      {"relation_id": "blocked-hold", "kind": "fallback", "from_clause_id": "assess", "to_clause_id": "hold", "trigger_field_id": "blocked", "trigger_value": true}
    ],
    "accepted_paths": [
      {"path_id": "publish-path", "required_clause_ids": ["collect", "assess", "publish"], "required_relation_ids": ["collect-before-assess"]},
      {"path_id": "hold-path", "required_clause_ids": ["collect", "assess", "hold"], "required_relation_ids": ["collect-before-assess", "blocked-hold"]}
    ]
  },
  "trials": [
    {
      "trial_id": "canonical-pass",
      "case_values": {"decision": "approved", "risk-level": "high", "blocked": false},
      "events": [
        {"event_id": "cp-collect", "sequence": 1, "kind": "tool_call", "clause_id": "collect", "tool_id": "lookup-evidence", "arguments": {"case-id": "canonical-pass"}, "runtime_status": "success"},
        {"event_id": "cp-assess", "sequence": 2, "kind": "decision", "clause_id": "assess"},
        {"event_id": "cp-approve", "sequence": 3, "kind": "decision", "clause_id": "approve"},
        {"event_id": "cp-publish", "sequence": 4, "kind": "artifact_write", "clause_id": "publish"}
      ],
      "final_artifact": {"endpoint_source": "final_artifact", "values": {"decision": "approved"}},
      "reported": {"runtime_metric_label": "runtime_execution", "runtime_success": true, "endpoint_match": true, "procedure_status": "conformant", "accepted_path_ids": ["publish-path"], "joint_status": "passed"}
    },
    {
      "trial_id": "alternative-pass",
      "case_values": {"decision": "held", "risk-level": "low", "blocked": true},
      "events": [
        {"event_id": "ap-collect", "sequence": 1, "kind": "tool_call", "clause_id": "collect", "tool_id": "lookup-evidence", "arguments": {"case-id": "alternative-pass"}, "runtime_status": "success"},
        {"event_id": "ap-assess", "sequence": 2, "kind": "decision", "clause_id": "assess"},
        {"event_id": "ap-hold", "sequence": 3, "kind": "artifact_write", "clause_id": "hold"}
      ],
      "final_artifact": {"endpoint_source": "final_artifact", "values": {"decision": "held"}},
      "reported": {"runtime_metric_label": "runtime_execution", "runtime_success": true, "endpoint_match": true, "procedure_status": "conformant", "accepted_path_ids": ["hold-path"], "joint_status": "passed"}
    },
    {
      "trial_id": "skipped-gate",
      "case_values": {"decision": "approved", "risk-level": "high", "blocked": false},
      "events": [
        {"event_id": "sg-collect", "sequence": 1, "kind": "tool_call", "clause_id": "collect", "tool_id": "lookup-evidence", "arguments": {"case-id": "skipped-gate"}, "runtime_status": "success"},
        {"event_id": "sg-assess", "sequence": 2, "kind": "decision", "clause_id": "assess"},
        {"event_id": "sg-publish", "sequence": 3, "kind": "artifact_write", "clause_id": "publish"}
      ],
      "final_artifact": {"endpoint_source": "final_artifact", "values": {"decision": "approved"}},
      "reported": {"runtime_metric_label": "runtime_execution", "runtime_success": true, "endpoint_match": true, "procedure_status": "procedure_wrong", "accepted_path_ids": ["publish-path"], "joint_status": "failed"}
    },
    {
      "trial_id": "wrong-order",
      "case_values": {"decision": "approved", "risk-level": "low", "blocked": false},
      "events": [
        {"event_id": "wo-assess", "sequence": 1, "kind": "decision", "clause_id": "assess"},
        {"event_id": "wo-collect", "sequence": 2, "kind": "tool_call", "clause_id": "collect", "tool_id": "lookup-evidence", "arguments": {"case-id": "wrong-order"}, "runtime_status": "success"},
        {"event_id": "wo-publish", "sequence": 3, "kind": "artifact_write", "clause_id": "publish"}
      ],
      "final_artifact": {"endpoint_source": "final_artifact", "values": {"decision": "approved"}},
      "reported": {"runtime_metric_label": "runtime_execution", "runtime_success": true, "endpoint_match": true, "procedure_status": "procedure_wrong", "accepted_path_ids": [], "joint_status": "failed"}
    },
    {
      "trial_id": "untriggered-fallback",
      "case_values": {"decision": "approved", "risk-level": "low", "blocked": false},
      "events": [
        {"event_id": "uf-collect", "sequence": 1, "kind": "tool_call", "clause_id": "collect", "tool_id": "lookup-evidence", "arguments": {"case-id": "untriggered-fallback"}, "runtime_status": "success"},
        {"event_id": "uf-assess", "sequence": 2, "kind": "decision", "clause_id": "assess"},
        {"event_id": "uf-hold", "sequence": 3, "kind": "decision", "clause_id": "hold"},